{
  "schema_version": "investigation-signal-v1",
  "signal_id": "market_ratio_2025_03",
  "case_classification": "FLAGSHIP",
  "analysis_level": "market",
  "metric": "claims_to_premiums_ratio",
  "institution_code": "",
  "institution_name": "Observed eligible market",
  "resource": "claims_to_premiums",
  "report_date": "2025-03-31",
  "availability_date": "2025-06-01",
  "observed_value": 0.6391391483302911,
  "expected_value": 0.5305365090821963,
  "residual": 0.10860263924809477,
  "relative_residual": 0.20470342264658153,
  "detector_reference": "residual_robust_z_12_months",
  "robust_z_score": 8.611067998372137,
  "standard_z_score": 2.9075782672289603,
  "cusum_state": {
    "level": "WATCH",
    "score": 3.4701792135896152,
    "positive": 3.4701792135896152,
    "negative": 0.0
  },
  "persistence_context": {
    "scope": "DECISION_TIME_ONLY",
    "backward_robust_run": 1,
    "backward_cusum_run": 1,
    "periods": [
      {
        "report_date": "2024-12-31",
        "availability_date": "2025-03-01",
        "relative_month": -3,
        "residual": 0.013309104249285053,
        "adjusted_signal_level": "NORMAL",
        "robust_z_score": 0.9175591889524858,
        "cusum_level": "NORMAL",
        "cusum_positive": 1.3911364375120443,
        "cusum_negative": 0.0,
        "context_status": "RECORDED",
        "known_by_signal_date": true
      },
      {
        "report_date": "2025-01-31",
        "availability_date": "2025-04-01",
        "relative_month": -2,
        "residual": -0.0009034700725668032,
        "adjusted_signal_level": "NORMAL",
        "robust_z_score": 0.21585950480910618,
        "cusum_level": "NORMAL",
        "cusum_positive": 1.2808009478780806,
        "cusum_negative": 0.0,
        "context_status": "RECORDED",
        "known_by_signal_date": true
      },
      {
        "report_date": "2025-02-28",
        "availability_date": "2025-05-01",
        "relative_month": -1,
        "residual": -0.00402339340856972,
        "adjusted_signal_level": "NORMAL",
        "robust_z_score": -0.16968226886036478,
        "cusum_level": "NORMAL",
        "cusum_positive": 1.0626009463606552,
        "cusum_negative": 0.0,
        "context_status": "RECORDED",
        "known_by_signal_date": true
      },
      {
        "report_date": "2025-03-31",
        "availability_date": "2025-06-01",
        "relative_month": 0,
        "residual": 0.10860263924809477,
        "adjusted_signal_level": "ALERT",
        "robust_z_score": 8.611067998372137,
        "cusum_level": "WATCH",
        "cusum_positive": 3.4701792135896152,
        "cusum_negative": 0.0,
        "context_status": "RECORDED",
        "known_by_signal_date": true
      }
    ]
  },
  "raw_signal_level": "NORMAL",
  "adjusted_signal_level": "ALERT",
  "materiality_level": "MEDIUM",
  "contributing_institutions": {
    "contributing_institutions": null,
    "excluded_institutions": null,
    "review_flagged_institutions": null,
    "blocked_contributors": null,
    "negative_contributors": null,
    "premium_contributing_institutions": 11,
    "claims_contributing_institutions": 11,
    "premium_excluded_institutions": 0,
    "claims_excluded_institutions": 0,
    "premium_review_flagged_institutions": 0,
    "claims_review_flagged_institutions": 0,
    "premium_blocked_contributors": 0,
    "claims_blocked_contributors": 0,
    "premium_negative_contributors": 0,
    "claims_negative_contributors": 0
  },
  "quality_flags": [
    "model_fit_review_sensitive"
  ],
  "composition_flags": [],
  "data_quality_risk": "MEDIUM",
  "quality_context": {
    "source_derivation_status": "derived_consecutive_month",
    "negative_review_sensitive": "False",
    "trend_training_negative_count": "0",
    "trend_training_review_count": "1",
    "seasonal_training_review_count": "0",
    "contributor_codes": "",
    "premium_contributor_codes": "0601;0603;0604;0606;0608;0609;0612;0613;0615;0617;0618",
    "claims_contributor_codes": "0601;0603;0604;0606;0608;0609;0612;0613;0615;0617;0618"
  },
  "cohort_sensitivity": "ROBUST",
  "negative_adjustment_sensitivity": "UNAFFECTED",
  "trend_window_sensitivity": "ALERT",
  "sensitivity_results": [
    {
      "scenario": "fixed_cohort_sensitivity",
      "status": "scored",
      "adjusted_signal_level": "ALERT",
      "robust_z_score": 4.9611357981137045,
      "residual": 0.09917828537435935
    },
    {
      "scenario": "negative_fit_sensitivity",
      "status": "scored",
      "adjusted_signal_level": "ALERT",
      "robust_z_score": 4.4664558062443165,
      "residual": 0.12071864567249646
    },
    {
      "scenario": "trend_window_sensitivity",
      "status": "scored",
      "adjusted_signal_level": "ALERT",
      "robust_z_score": 5.82813160018328,
      "residual": 0.08362457137890456
    }
  ],
  "case_study_score": 12,
  "case_study_score_purpose": "DEMO_SUITABILITY_NOT_ANOMALY_SCORE",
  "source_report_paths": [
    "reports/case-studies/market_ratio_2025_03.md",
    "reports/case-studies/case_selection_summary.md"
  ],
  "sources": [
    {
      "path": "data/processed/cnbs/expected-behavior/expected_behavior_manifest.json",
      "sha256": "a2ea5149bf2547ed839e720d1b19f8969ac2efea689bcccf401a5b7e98df3a4b"
    },
    {
      "path": "data/processed/cnbs/expected-behavior/fixed_cohort_sensitivity.csv",
      "sha256": "737e5cb7c27b119a749472887e2a927dc807921ab67aea99cd36423c18988865"
    },
    {
      "path": "data/processed/cnbs/expected-behavior/negative_fit_sensitivity.csv",
      "sha256": "b0f3beacec213dbf4336351d63d6a9f2b9b67d54789e5c7afbd71ecda5c3c1bf"
    },
    {
      "path": "data/processed/cnbs/expected-behavior/primary_dynamic.csv",
      "sha256": "9091051504b5b05f36b22480057e5dd24045e1009ef84dd1abd3080a36add4ed"
    },
    {
      "path": "data/processed/cnbs/expected-behavior/trend_window_sensitivity.csv",
      "sha256": "b98ecf2486736c68bbdaa6898b172820fb3ef890a6391e8118d662184f1961c2"
    },
    {
      "path": "reports/case-studies/candidate_evaluations.csv",
      "sha256": "2814f89a0c0d2b59cb1d0f6223a458dbbf5816d532e7f3693da8675ef329cf33"
    },
    {
      "path": "reports/case-studies/case_selection_manifest.json",
      "sha256": "48e3e23a1f3fa07281c83cf36adbae6a3b0c9a1c38be55aca82df37be32eaff9"
    },
    {
      "path": "reports/case-studies/case_selection_summary.md",
      "sha256": "3623b5269ca8a3b15adc446176c9737a94811da91b4993a09d0f6bc06b87522f"
    },
    {
      "path": "reports/case-studies/market_ratio_2025_03.md",
      "sha256": "5c2ed6cc333f1ee01037402c1364d0fdbc7285d11a56195b99424826104829d5"
    },
    {
      "path": "reports/case-studies/surrounding_periods.csv",
      "sha256": "2f477e8008540c8d393368e77773c8e1332249e18ccb1ee790a4cf400965c026"
    }
  ],
  "methodology_version": "expected-behavior-v1 / statistical-baseline-v1 / case-selection-phase3.5",
  "replay_mode": "LAGGED_RETROSPECTIVE_BACKTEST",
  "strict_point_in_time_status": "NOT_VALIDATED",
  "snapshot_evaluation_cutoff": "2026-10-03",
  "investigation_mode": "RETROSPECTIVE_CASE_REVIEW",
  "limitations": [
    "Current historical snapshot may contain later revisions; exact releases/vintages are unavailable.",
    "Conservative calendar lag is a modeling assumption, not the CNBS publication schedule.",
    "Fixed-cohort membership uses hindsight; case suitability is not an anomaly score.",
    "UNAFFECTED preserves signal classification/residual tolerance, not numerical calibration stability.",
    "Materiality bands are exploratory; claims_to_premiums_ratio is not a validated actuarial loss ratio.",
    "Forward follow-up is excluded from this package; full case reports contain retrospective follow-up.",
    "Statistical deviations do not establish cause or continued growth."
  ]
}
